authors,first_name,last_name,title,description,rating,review_date,review,status,began_date,completed_date,tags,notes,groups,copies,created,publisher,publish_date,pages,price,isbn10,isbn13
"Barbara O'Connor",Barbara,O'Connor,Wish,"A touching story about a girl and her dog, perfect for young animal loversEleven-year-old Charlie Reese has been making the same secret wish every day since fourth grade. She even has a list of all the ways there are to make the wish, such as cutting off the pointed end of a slice of pie and wishing on it as she takes the last bite. But when she is sent to the Blue Ridge Mountains of North Carolina to live with family she barely knows, it seems unlikely that her wish will ever come true. That is, until she meets Wishbone, a skinny stray dog who captures her heart, and Howard, a neighbor boy who proves surprising in lots of ways. Suddenly Charlie is in serious danger of discovering that what she thought she wanted may not be what she needs at all. From award-winning author Barbara O'Connor comes a middle-grade novel about a girl who, with the help of a true-blue friend, a big-hearted aunt and uncle, and the dog of her dreams, unexpectedly learns the true meaning of family in the least likely of places. This title has Common Core connections.Praise for Wish:“At school, at home, and in the community, the characters and settings are well drawn, but it’s the narrator’s convincing, compelling voice that will draw readers into the novel and keep them there until her wish finally comes true.” ―Booklist“The many ways [Charlie] wishes form something of a catalog of folk and family traditions and are delightful all by themselves....Speaking in an honest voice revealing her hurt, resentment, and vulnerability, Charlies explains how her wish comes true. A warm, real, and heartfelt tale.” ―Kirkus Reviews“O’Connor again finds the sweet spot for young readers who are beyond early chapter books but not quite ready for the cynicism and/or complexity of much tween-into-teen lit. Bertha, Gus, and the Odoms are certainly awash in goodness, but their big-heartedness never devolves into sentimentality.” ―The Bulletin“Like a generous portions of grits, Wish makes the world a little better.” ―Bookpage “This heartwarming story is not to be missed.” ―Kidsreads",,,,,,,,,,1,2021-06-29,"Square Fish",2017-08-29,256,,1250144051,9781250144058
"Lynda Mullaly Hunt",Lynda,Hunt,"Fish in a Tree","""Fans of R.J. Palacio’s Wonder will appreciate this feel-good story of friendship and unconventional smarts.” —Kirkus ReviewsAlly has been smart enough to fool a lot of smart people. Every time she lands in a new school, she is able to hide her inability to read by creating clever yet disruptive distractions.  She is afraid to ask for help; after all, how can you cure dumb? However, her newest teacher Mr. Daniels sees the bright, creative kid underneath the trouble maker. With his help, Ally learns not to be so hard on herself and that dyslexia is nothing to be ashamed of. As her confidence grows, Ally feels free to be herself and the world starts opening up with possibilities. She discovers that there’s a lot more to her—and to everyone—than a label, and that great minds don’t always think alike.The author of the beloved One for the Murphys gives readers an emotionally-charged, uplifting novel that will speak to anyone who’s ever thought there was something wrong with them because they didn’t fit in.A New York Times Bestseller! * “Unforgettable and uplifting.”—School Library Connection, starred review* ""Offering hope to those who struggle academically and demonstrating that a disability does not equal stupidity, this is as unique as its heroine.”—Booklist, starred review* “Mullaly Hunt again paints a nuanced portrayal of a sensitive, smart girl struggling with circumstances beyond her control."" —School Library Journal, starred review ",,,,,,,,,,1,2021-06-29,"Puffin Books",2017-03-28,320,,0142426423,9780142426425
"Katherine Applegate",Katherine,Applegate,Crenshaw,"In her first novel since winning the Newbery Medal, New York Times bestselling author Katherine Applegate delivers an unforgettable and magical story about family, friendship, and resilience. Jackson and his family have fallen on hard times. There's no more money for rent. And not much for food, either. His parents, his little sister, and their dog may have to live in their minivan. Again. Crenshaw is a cat. He's large, he's outspoken, and he's imaginary. He has come back into Jackson's life to help him. But is an imaginary friend enough to save this family from losing everything? Beloved author Katherine Applegate proves in unexpected ways that friends matter, whether real or imaginary.Praise for Crenshaw:“The tone is warm and, occasionally, quirkily funny, but it doesn't sugarcoat the effects of hunger and vulnerability. This novel adds a middle-grade perspective to the literature of imaginary friends and paints a convincing and compassionate portrait of a social class―the working poor―underrepresented in children's books.” ―The Horn Book, starred review""...a quick read that encourages people of all ages to be honest with one another and value family and friends (real and imaginary!)"" ―Booklist",,,,,,,,,,1,2021-06-29,"Square Fish",2017-09-26,272,,1250091667,9781250091666
"Jacqueline Woodson",Jacqueline,Woodson,"Brown Girl Dreaming","Jacqueline Woodson's National Book Award and Newbery Honor winner, now available in paperback with 7 all new poems.Raised in South Carolina and New York, Woodson always felt halfway home in each place. In vivid poems, she shares what it was like to grow up as an African American in the 1960s and 1970s, living with the remnants of Jim Crow and her growing awareness of the Civil Rights movement. Touching and powerful, each poem is both accessible and emotionally charged, each line a glimpse into a child’s soul as she searches for her place in the world. Woodson’s eloquent poetry also reflects the joy of finding her voice through writing stories, despite the fact that she struggled with reading as a child. Her love of stories inspired her and stayed with her, creating the first sparks of the gifted writer she was to become.Includes 7 new poems, including ""Brown Girl Dreaming"". Praise for Jacqueline Woodson:Ms. Woodson writes with a sure understanding of the thoughts of young people, offering a poetic, eloquent narrative that is not simply a story . . . but a mature exploration of grown-up issues and self-discovery.”—The New York Times Book Review",,,,,,,,,,1,2021-06-29,"Puffin Books",2016-10-11,368,,0147515823,9780147515827
"Stephen Alter",Stephen,Alter,"Ghost Letters","When two modern-day kids discover a grotesque secret in an abandoned mailbox, they have no idea they are about to be drawn into a mystery that began on the other side of the world. Through the help of an English genie and a phantom postman, the two children begin to communicate with a young calligrapher's apprentice who lived 125 years ago in a small, Himalayan village. Writing back and forth, across continents and centuries, the three children eventually realize the possibility of changing history by delivering three letters that were never received. The first is a love letter that could have drawn a broken-hearted Yankee trader back from his lonely exile in the east. The second is a ransom note, and the third, a cryptic missive in a bottle. If the three can make sure these lost letters reach those for whom they were intended, love may be restored, the life of a kidnapped child could be saved, and a secret agent might be able to prevent a pointless war.",,,,,,,,,,1,2021-06-29,"Scholastic Book Clubs",,227,,0545133343,9780545133340
"Vivian Vande Velde",Vivian,Velde,"Smart Dog","They can roll over. They can fetch a stick or ball. They can even understand words like ""sit"" or ""stay."" But they most certainly can't say,""excuse me. I'm in trouble. Could you please help me?"" Or at least that's what Amy thinks before she meets Sherlock. A brilliant talking dog who escaped from a university lab",,,,,,,,,,1,2021-06-29,Scholastic,,,,0545060702,9780545060707
"Louis Sachar",Louis,Sachar,"Sideways Stories from Wayside School","A Crazy Mixed-up School.There'd been a terrible mistake. Wayside School was supposed to be built with thirty classrooms one on top of the other...thirty stories tall! (The builder said he was very sorry.)That may be why all kinds of funny things happen at Wayside SChool...especially on the thirteenth floor. You'll meet Mrs. Gorf, the meanest teacher of all, terrible Todd, who always gets sent home early, and John who can read only upside down--along with all the other kids in the crazy mix-up school that came out sideways. But you'll never guess the truth about Sammy, the new kid...or what's in store for Wayside School on Halloween!There was a terrible mistake-Wayside School was built with one classroom on top of another, thirty stories high! (The builder said he was sorry.) Maybe that's why all kinds of funny things happened at Wayside-especially on the thirteenth floor.",,,,,,,,,,1,2021-06-29,HarperCollins,1985-08-01,128,,0380698714,9780380698714
"Liz Kessler",Liz,Kessler,"Emily Windsnap and the Monster from the Deep","Reunited with her merman father and now living on an island located in the Bermuda Triangle, twelve-year-old Emily accidentally awakens the fearsome kraken and also faces a bully from her past.",,,,,,,,,,1,2021-06-29,,,219,,0439928249,9780439928243
"L. Frank Baum,Children's Classics",L.,Baum,"Wonderful Wizard of Oz (Dover Children's Evergreen Classics), The","Dorothy, the Tin Woodman, Scarecrow, the Cowardly Lion, and a host of other curious creatures come to life as they set out on an exciting quest down the Yellow Brick Road in search of the elusive Wizard. Reset in large, clear type and accompanied by 20 beautiful black-and-white illustrations. A selection of the Common Core State Standards Initiative.",,,,,,,,,,1,2021-06-29,"Dover Publications",1996-05-20,128,,97804862911,9780486291161
"Lewis Carroll",Lewis,Carroll,"Alice's Adventures in Wonderland (Puffin Chalk)","When Alice follows the White Rabbit down a rabbit hole, she finds herself in an enchanted world, filled with creatures like the Mad Hatter, the disappearing Cheshire Cat, and the Queen of Hearts. Alice quickly finds out that nothing is as it seems in the wild world of Wonderland…",,,,,,,,,,1,2021-06-29,Puffin,2014-03-06,160,,0147510988,9780147510983
"John Grogan",John,Grogan,"Marley & Me tie-in: Life and Love with the World's Worst Dog","Is it possible for humans to discover the key to happiness through a bigger-than-life, bad-boy dog? Just ask the Grogans.John and Jenny were just beginning their life together. They were young and in love, with not a care in the world. Then they brought home Marley, a wiggly yellow furball of a puppy. Life would never be the same.Marley grew into a barreling, ninety-seven-pound streamroller of a Labrador retriever. He crashed through screen doors, gouged through drywall, and stole women's undergarments. Obedience school did no good -- Marley was expelled.But just as Marley joyfully refused any limits on his behavior, his love and loyalty were boundless, too. Marley remained a model of devotion, even when his family was at its wit's end. Unconditional love, they would learn, comes in many forms.Marley & Me is John Grogan's funny, unforgettable tribute to this wonderful, wildly neurotic Lab and the meaning he brought to their lives.",,,,,,,,,,1,2021-06-29,"William Morrow Paperbacks",2008-10-28,307,,0061718653,9780061718656
"Brad Strickland",Brad,Strickland,"Storm #4 (Flight 29 Down), The","Daley, Nathan, and the rest of the survivors of Flight 29 Down have learned to rely on one another for nothing less than survival. After all, they’re in the wilderness, and if they can’t work together, no one is safe. So when personal belongings start to go missing, the bonds of trust are shattered—with dangerous consequences . . .",,,,,,,,,,1,2021-06-29,"Grosset & Dunlap",2006-08-03,224,,0448441306,9780448441306
"John Vornholt",John,Vornholt,"Return #3 (Flight 29 Down), The","After a week of being stranded on an unknown island, the remaining  seven survivors of Flight 29 Down have pretty much gotten  their routine down. Everyone has his or her job and pulls his or her  weight. But when an unexpected visitor suddenly reappears on the  scene, will she disrupt their delicate balance?",,,,,,,,,,1,2021-06-29,"Grosset & Dunlap",2006-06-01,224,,0448441292,9780448441290
"Walter Sorrells",Walter,Sorrells,"Ten Rules (Flight 29 Down)","Fans of Flight 29 Down have watched the castaways slowly build a  home together and learn to navigate the perils of the desert island  on which they’re stranded. But what about the beginning, when  they were classmates together—some friends, some rivals, and  some unrequited crushes? Go back in time and relive the events  leading up to the fateful flight in this drama-packed prequel!",,,,,,,,,,1,2021-06-29,"Grosset & Dunlap",2006-10-05,224,,0044844402,9780448444024
,,,"Harold Snipperpot’s Best Disaster Ever","Harold is turning seven years old. Hes never had a real birthday party. His parents are too grumpy. But this year is going to be different. Thanks to an amazing man named Mr. Ponzio, something incredible is going to happen on Harolds birthday and its going to be absolutely extraordinary",,,,,,,,,,1,2021-06-29,"Thames and Hudson Ltd",2019-01-31,,,0500651876,9780500651872
"Matt de la Peña",Matt,Peña,"Last Stop on Market Street","Every Sunday after church, CJ and his grandma ride the bus across town. But today, CJ wonders why they don't own a car like his friend Colby. Why doesn’t he have an iPod like the boys on the bus? How come they always have to get off in the dirty part of town? Each question is met with an encouraging answer from grandma, who helps him see the beautyand funin their routine and the world around them.   This energetic ride through a bustling city highlights the wonderful perspective only grandparent and grandchild can share, and comes to life through Matt de la Pena’s vibrant text and Christian Robinson’s radiant illustrations.",,,,,,,,,,1,2021-06-29,"Putnam Juvenile",2015-01-08,32,,0399257748,9780399257742
"Gustavo dore",Gustavo,dore,"Perraults fairy tales",,,,,,,,,,,1,2021-06-29,,,,,,
"Mark Kelly",Mark,Kelly,"Mousetronaut: Based on a (Partially) True Story (Paula Wiseman Books)","A heartwarming picture book tale of the power of the small, from bestselling author and retired NASA astronaut Commander Mark Kelly.Astronaut Mark Kelly flew with “mice-tronauts” on his first spaceflight aboard space shuttle Endeavour in 2001. Mousetronaut tells the story of a small mouse that wants nothing more than to travel to outer space. The little mouse works as hard as the bigger mice to show readiness for the mission . . . and is chosen for the flight! While in space, the astronauts are busy with their mission when disaster strikes—and only the smallest member of the crew can save the day. With lively illustrations by award-winning artist C. F. Payne, Mousetronaut is a charming tale of perseverance, courage, and the importance of the small!",,,,,,,,,,1,2021-06-29,"Simon & Schuster/Paula Wiseman Books",2012-10-09,40,,1442458240,9781442458246
"Barry Wittenstein",Barry,Wittenstein,"Boo-Boos That Changed the World: A True Story About an Accidental Invention (Really!), The","Did you know Band-Aids were invented by accident?! And that they weren't mass-produced until the Boy Scouts gave their seal of approval?1920s cotton buyer Earle Dickson worked for Johnson & Johnson and had a klutzy wife who often cut herself. The son of a doctor, Earle set out to create an easier way for her to bandage her injuries. Band-Aids were born, but Earle's bosses at the pharmaceutical giant weren't convinced, and it wasn't until the Boy Scouts of America tested Earle's prototype that this ubiquitous household staple was made available to the public. Soon Band-Aids were selling like hotcakes, and the rest is boo-boo history.""Appealingly designed and illustrated, an engaging, fun story"" — Kirkus Reviews STARRED REVIEW",,,,,,,,,,1,2021-06-29,Charlesbridge,2018-02-13,32,,1580897452,9781580897457
"Monica Clark-Robinson",Monica,Clark-Robinson,"Let the Children March","I couldn't play on the same playground as the white kids. I couldn't go to their schools.  I couldn't drink from their water fountains.  There were so many things I couldn't do.  In 1963 Birmingham, Alabama, thousands of African American children volunteered to march for their civil rights after hearing Dr. Martin Luther King Jr. speak. They protested the laws that kept black people separate from white people. Facing fear, hate, and danger, these children used their voices to change the world. Frank Morrison's emotive oil-on-canvas paintings bring this historical event to life, while Monica Clark-Robinson's moving and poetic words document this remarkable time. ",,,,,,,,,,1,2021-06-29,"HMH Books for Young Readers",2018-01-02,40,,0544704525,9780544704527
"Joanna Gaines,Julianna Swaney (Illustrator)",Joanna,Gaines,"World Needs Who You Were Made to Be, The","The World Needs Who You Were Made to Be, the second children's book by New York Times bestselling author Joanna Gaines, illustrated by Julianna Swaney, celebrates how creativity and acceptance can come together to make for a bright and beautiful adventure. The book follows a group of children as they each build their very own hot-air balloons. As the kids work together, leaning into their own skills and processes, to fill the sky with beautiful colors, we discover that the same is true for life--it's more beautiful and vibrant when our differences are celebrated. Together with Joanna, you and your kids will take a journey of growth and imagination as you learn in full color that: We should celebrate every child's one-of-a-kind strengths as well as teamwork and acceptance of differences Everything can be made more beautiful when we share our talents and abilities We should lend a helping hand and do our best to take care of one another The World Needs Who You Were Made to Be is a vibrant picture book perfect for: Ages 4-8 Parents, libraries, classroom story times, and discussions about diversity and being a good human being Households that enjoy watching Chip and Joanna on Magnolia Network and HGTV's Fixer Upper With plenty of pink, a bounty of blue, orange and green and yellow too, this vibrant hot-air balloon adventure celebrates every child and teaches kids that we are in this together. ""You're one of a kind, and it's so clear to see: The world needs who you were made to be.""",,,,,,,,,,1,2021-06-29,"Thomas Nelson Incorporated",2020-11-10,32,,1400314232,9781400314232
"Chelsea Clinton",Chelsea,Clinton,"She Persisted Around the World: 13 Women Who Changed History","The companion to Chelsea Clinton & Alexandra Boiger's #1 New York Times bestseller, She Persisted. Perfect for tiny activists, mini feminists and little kids who are ready to take on the world.Women around the world have long dreamed big, even when they've been told their dreams didn't matter. They've spoken out, risen up and fought for what's right, even when they've been told to be quiet. Whether in science, the arts, sports or activism, women and girls throughout history have been determined to break barriers and change the status quo. They haven't let anyone get in their way and have helped us better understand our world and what's possible. In this companion book to She Persisted: 13 American Women Who Changed the World, Chelsea Clinton introduces readers to a group of thirteen incredible women who have shaped history all across the globe.She Persisted Around the World is a book for everyone who has ever aimed high and been told to step down, for everyone who has ever raised their voice and been told to quiet down, and for everyone who has ever felt small, unimportant or unworthy.Alexandra Boiger's vibrant artwork accompanies this inspiring text that shows readers of all ages that, no matter what obstacles come their way, they have the power to persist and succeed.This book features: Marie Curie, Sor Juana Ines de la Cruz, Viola Desmond, Sissi Lima do Amor, Leymah Gbowee, Caroline Herschel, Wangari Maathai, Aisha Rateb, J.K. Rowling, Kate Sheppard, Yuan Yuan Tan, Mary Verghese and Malala Yousafzai.Praise for She Persisted:* ""[A] lovely, moving work of children's literature [and a] polished introduction to a diverse and accomplished group of women."" --Publishers Weekly, starred review""Exemplary . . . This well-curated list will show children that women's voices have made themselves emphatically heard."" --Booklist""[She Persisted] will remind little girls that they can achieve their goals if they don't let obstacles get in the way."" --Family Circle ""We can't wait to grab a copy for some of the awesome kids in our lives . . . and maybe some of the grown-ups, too."" --Bustle""A message we all need to hear."" --Scary Mommy ""This will be a great read for kids (especially young girls)."" --Romper""We cannot wait for the launch of Smart Girl Chelsea Clinton's new book to help remind kids everywhere that the fearlessness that characterizes the thirteen women in the book is what has emboldened us to constantly strive for progress and justice."" --Amy Poehler's Smart Girls",,,,,,,,,,1,2021-06-29,"Philomel Books",2018-03-06,32,,0525516999,9780525516996
"Richard T. Morris",Richard,Morris,"This Is a Moose","Lights! Camera! Moose!MOOSE? Yes, Moose! When a movie director tries to capture the life of a moose on film, he's in for a big surprise. It turns out the moose has a dream bigger then just being a moose--he wants to be an astronaut and go to the moon. His forest friends step in to help him, and action ensues. Lots of action. Like a lacrosse-playing grandma, a gigantic slingshot into space, and a flying, superhero chipmunk.In this hilarious romp, Richard T. Morris and bestselling illustrator Tom Lichtenheld remind us to dream big and, when we do, to aim for the moon. ",,,,,,,,,,1,2021-06-29,"Little, Brown Books for Young Readers",2014-05-06,48,,0316213608,9780316213608
"Sara Pennypacker,Jon Klassen (Illustrator)",Sara,Pennypacker,Pax,"National Book Award Longlist * New York Times Bestseller * An Amazon Best Book of the Year Finally in paperback! This handsome edition features French flaps. From bestselling and award-winning author Sara Pennypacker comes a beautifully wrought, utterly compelling novel about the powerful relationship between a boy and his fox. Pax is destined to become a classic, beloved for generations to come. Pax and Peter have been inseparable ever since Peter rescued him as a kit. But one day, the unimaginable happens: Peter's dad enlists in the military and makes him return the fox to the wild. At his grandfather's house, three hundred miles away from home, Peter knows he isn't where he should be--with Pax. He strikes out on his own despite the encroaching war, spurred by love, loyalty, and grief, to be reunited with his fox. Meanwhile Pax, steadfastly waiting for his boy, embarks on adventures and discoveries of his own. . . .",,,,,,,,,,1,2021-07-26,"HarperCollins Publishers",2019-04-02,304,,0062377027,9780062377029
"Tom Rogers",Tom,Rogers,Eleven,"Alex Douglas always wanted to be a hero.  But nothing heroic ever happened to Alex.  Nothing, that is, until his eleventh birthday.  When Alex rescues a stray dog as a birthday gift to himself, he doesn't think his life can get much better.  Radar, his new dog, pretty much feels the same way.  But this day has bigger things in store for both of them.  This is a story about bullies and heroes.  About tragedy and hope.  About enemies with two legs and friends with four, and pesky little sisters and cranky old men, and an unexpected lesson in kindness delivered with a slice of pizza.  This is Eleven:  the journey of a boy turning eleven on 9/11.",,,,,,,,,,1,2021-07-26,"Alto Nido Press, LLC",2014-01-14,200,,099118100X,9780991181001
"Gordon Korman",Gordon,Korman,Restart,"Chase's memory just went out the window. Chase doesn't remember falling off the roof. He doesn't remember hitting his head. He doesn't, in fact, remember anything. He wakes up in a hospital room and suddenly has to learn his whole life all over again . . . starting with his own name. He knows he's Chase. But who is Chase? When he gets back to school, he sees that different kids have very different reactions to his return. Some kids treat him like a hero. Some kids are clearly afraid of him. One girl in particular is so angry with him that she pours her frozen yogurt on his head the first chance she gets. Pretty soon, it's not only a question of who Chase is--it's a question of who he was . . . and who he's going to be. From the #1 bestselling author of Swindle and Slacker, Restart is the spectacular story of a kid with a messy past who has to figure out what it means to get a clean start.",,,,,,,,,,1,2021-07-26,"Scholastic Press",2018-03-27,256,,1338053809,9781338053807
